{
  "$schema": "../schema/Com.schema.json",
  "module": "Com",
  "rxIpduCountDoc": [
    "RX I-PDU テーブルのエントリ数",
    "DaVinci: /ActiveEcuC/Com/ComConfig/ 内 Direction=RECEIVE の ComIPdu 数",
    "[0]=EngineInfo 0x100, [1]=AbsInfo 0x110,",
    "[2]=SecureCommand 0x120（SecOC 検証成功後に転送）"
  ],
  "txIpduCountDoc": [
    "TX I-PDU テーブルのエントリ数",
    "DaVinci: /ActiveEcuC/Com/ComConfig/ 内 Direction=SEND の ComIPdu 数",
    "[0]=MeterStatus 0x200 (MIXED: 変化時送信 + 周期フロア。DLC=6、",
    "byte[0]=EngineState、byte[1]=update-bit、byte[2]=警告灯3bit、",
    "byte[3-4]=EngineSpeedミラー、byte[5]=CoolantTempミラー)、",
    "[1]=WarningStatus 0x210 (Signal Group, DIRECT: 変化時のみ送信)、",
    "[2]=E2EHealthStatus 0x220 (PERIODIC、E2EMon CDD 相当が発行するネットワーク",
    "健全性テレメトリ。詳細は src/Bsw/E2EMon/E2EMon.c 参照)、",
    "[3]=ImmobilizerStatus 0x230 (DIRECT: 変化時のみ送信。Signal Gateway が",
    "ImmobilizerCmd（RX、SecOC 検証済み）から SWC を介さず直接転送する。",
    "詳細は Com_PBCfg.c の Com_GwMappingData 参照)、",
    "[4]=TestMsg 0x300 (PERIODIC 1000ms。信号追加の練習用のテスト専用フレーム)"
  ],
  "signalCountDoc": [
    "シグナルテーブルのエントリ数（RX + TX の合計）",
    "DaVinci: /ActiveEcuC/Com/ComConfig/ 内 ComSignal ノード数の合計"
  ],
  "gwMappingCountDoc": [
    "Signal Gateway ルーティングテーブルのエントリ数",
    "DaVinci: /ActiveEcuC/Com/ComConfig/[ComGwMapping] ノード数",
    "[0]=ImmobilizerCmd(RX) → ImmobilizerStatus(TX)"
  ],
  "ipduGroups": [
    {
      "macro": "COM_IPDU_GROUP_TELEMETRY",
      "doc": [
        "テレメトリ I-PDU Group（E2EHealthStatus のみ）。",
        "診断監視用のネットワーク健全性テレメトリであり、車両の基本動作には",
        "不要なため、独立して停止/再開できる I-PDU Group として分離している",
        "（MeterStatus/WarningStatus/ImmobilizerCmd/ImmobilizerStatus は",
        "どの I-PDU Group にも属さず、常に有効。BswM が EcuM の POST_RUN/RUN",
        "遷移に応じて Com_IpduGroupStop/Start を呼ぶ。詳細は",
        "src/Bsw/BswM/BswM_PBCfg.c 参照）"
      ]
    },
    {
      "macro": "COM_IPDU_GROUP_SENSOR_RX",
      "doc": [
        "センサー RX I-PDU Group（EngineInfo/AbsInfo のみ、2026-08 追加）。",
        "この 2 本は元々 COM_IPDU_GROUP_NONE（常に有効）だったが、Bus-Sleep",
        "（ComM が NO_COMMUNICATION へ離脱、真の物理スリープ）中も受信",
        "デッドライン監視が止まらず、意図的な通信断（スリープ）のたびに",
        "「RX timeout」警告 + Dem の FAILED DTC が誤って記録される問題が",
        "あった（Bus-Sleep中は相手も送信を止めるため、5000ms 以上のスリープは",
        "珍しくない）。BswM が FULL_COM 到達で Com_IpduGroupStart・",
        "NO_COMMUNICATION 到達で Com_IpduGroupStop を呼ぶことで、意図的な",
        "物理スリープの間は受信処理・デッドライン監視とも評価対象から外れる",
        "ようにした（[SWS_Com_00684]/[SWS_Com_00685]）。",
        "TX 側の COM_IPDU_GROUP_TELEMETRY とは停止条件が異なる点に注意:",
        "TX は SILENT_COMMUNICATION（Bus-Off 等による受信専用モード）でも",
        "送信できないため停止して正しいが、RX は SILENT_COMMUNICATION 中も",
        "受信自体は生きているため、これを停止条件に含めると実際に届いている",
        "フレームを誤って捨ててしまう（/code-review で指摘・是正）。同じ理由で",
        "POST_RUN でも停止しない（EngineInfo/AbsInfo は元々 POST_RUN 中も",
        "監視を続ける設計だった）。詳細は",
        "src/Bsw/BswM/BswM_PBCfg.c・docs/modules/Com_Notes.md 参照。"
      ]
    }
  ],
  "constants": [
    {
      "macro": "COM_TIMEOUT_ENGINE_INFO_MS",
      "fromFrame": {
        "frame": "EngineInfo",
        "key": "rxTimeoutMs"
      },
      "doc": [
        "EngineInfo (0x100) 受信タイムアウト [ms]",
        "エンジン ECU からの受信が途絶えた場合に FAULT 遷移させる基準時間。",
        "App_EngineManager_Run の周期 (3000ms) より長く設定すること。"
      ]
    },
    {
      "macro": "COM_TIMEOUT_ABS_INFO_MS",
      "fromFrame": {
        "frame": "AbsInfo",
        "key": "rxTimeoutMs"
      },
      "doc": [
        "AbsInfo (0x110) 受信タイムアウト [ms]",
        "ABS ECU からの受信が途絶えた場合に ABS 警告灯を消灯にフォールバックする。"
      ]
    },
    {
      "macro": "COM_TX_PERIOD_E2EHEALTH_MS",
      "fromFrame": {
        "frame": "E2EHealthStatus",
        "key": "txPeriodMs"
      },
      "doc": [
        "E2EHealthStatus (0x220) の PERIODIC 送信周期 [ms]",
        "DaVinci: /ActiveEcuC/Com/ComConfig/[ComIPdu]/ComTxModeTimePeriodFactor"
      ]
    },
    {
      "macro": "COM_TX_PERIOD_TESTMSG_MS",
      "fromFrame": {
        "frame": "TestMsg",
        "key": "txPeriodMs"
      },
      "doc": [
        "TestMsg (0x300、テスト専用) の PERIODIC 送信周期 [ms]",
        "値が変化しなくても、この周期で送信し続ける（信号追加の練習・動作確認用）。"
      ]
    },
    {
      "macro": "COM_TX_PERIOD_METERSTATUS_FLOOR_MS",
      "fromFrame": {
        "frame": "MeterStatus",
        "key": "txPeriodMs"
      },
      "doc": [
        "MeterStatus (0x200) の MIXED 送信モードにおける周期フロア間隔 [ms]",
        "DaVinci: /ActiveEcuC/Com/ComConfig/[ComIPdu]/ComTxModeFalse/ComTxModeTimePeriodFactor",
        "",
        "ComFilterAlgorithm によって「変化なし」と判定され続けても、最終送信から",
        "この間隔が経過したら Com_MainFunctionTx() が強制的に再送する（実車の MIXED",
        "送信モードが持つ「周期フロア」。起動直後や瞬断から復帰した受信側が、",
        "いつまでも古い EngineState を握り続けないようにするための保険）。",
        "値が変化した場合は、このフロアを待たず次回 Com_MainFunctionTx()（Os の",
        "100ms タスク）で送信する。"
      ]
    },
    {
      "macro": "COM_TX_TIMEOUT_METERSTATUS_MS",
      "value": 2000,
      "doc": [
        "MeterStatus (0x200) の TX 送信デッドライン監視（Com_CbkTxTOut、",
        "SWS_Com_00878/00879/00880/00304/00554）の閾値 [ms]",
        "DaVinci: /ActiveEcuC/Com/ComConfig/[ComIPdu]/ComTransmissionDeadlineMonitoring/",
        "ComFirstTimeout・ComTimeout",
        "",
        "PduR_ComTransmit() へ渡してから Com_TxConfirmation() が届くまでの許容時間。",
        "実送信間隔（COM_TX_PERIOD_METERSTATUS_FLOOR_MS=9000ms）より十分短く、",
        "現実的な確認応答遅延より十分長い値とし、First/Timeout 共通で使う",
        "（EngineInfo の COM_TIMEOUT_ENGINE_INFO_MS と同じ流儀）。実機で発動する",
        "経路は無い（docs/modules/Com_Notes.md 参照）——仕様忠実性のための実装で、",
        "Com_CbkTxErr と同じ位置づけ。"
      ]
    },
    {
      "macro": "COM_TX_PERIOD_WARNINGSTATUS_TRUE_FLOOR_MS",
      "fromFrame": {
        "frame": "WarningStatus",
        "key": "txPeriodMs"
      },
      "doc": [
        "WarningStatus (0x210) の TMS（Transmission Mode Selector）が true と",
        "評価された（FaultLamp/AbsLamp のいずれかが点灯中の）ときに使う",
        "MIXED 送信モードの周期フロア間隔 [ms]",
        "DaVinci: /ActiveEcuC/Com/ComConfig/[ComIPdu]/ComTxModeTrue/ComTxModeTimePeriodFactor",
        "",
        "TMS が false（全ランプ消灯）の間は DIRECT（周期フロアなし、変化時のみ送信）",
        "だが、FAULT/ABS のいずれかが点灯している間は他 ECU・監視ツールが途中から",
        "参加した場合でも状態を把握できるよう、この間隔で強制的に再送する",
        "（MeterStatus の周期フロアより短くしているのは、警告状態の方が早く",
        "伝わってほしいという判断）。"
      ]
    },
    {
      "macro": "COM_TX_MIN_DELAY_WARNINGSTATUS_MS",
      "value": 100,
      "doc": [
        "WarningStatus (0x210) の MDT（ComMinimumDelayTime、変化時送信の最小送信間隔）[ms]",
        "DaVinci: /ActiveEcuC/Com/ComConfig/[ComIPdu]/ComMinimumDelayTime",
        "",
        "直近の実送信からこの時間未満しか経過していなければ、値が変化しても実送信を",
        "保留する（破棄はしない。満了次第送信する）。バス輻輳防止のための保護的な",
        "既定値であり、本プロジェクトの ASW（App_WarningIndicator_Run、500ms 周期）",
        "は現状これより速く値を変化させないため、通常運用でこの下限に達することは",
        "ない（詳細は docs/modules/Com_Notes.md の「MDT」セクション参照）。MIXED の周期フロア送信には",
        "適用しない（Com_Cfg.h の COM_TX_PERIOD_WARNINGSTATUS_TRUE_FLOOR_MS 参照）。"
      ]
    },
    {
      "macro": "COM_TX_TIMEOUT_WARNINGSTATUS_MS",
      "value": 2000,
      "doc": [
        "WarningStatus (0x210) の TX 送信デッドライン監視（Com_CbkTxTOut、",
        "SWS_Com_00878 等）用の First/Timeout 共通値 [ms]",
        "DaVinci: /ActiveEcuC/Com/ComConfig/[ComIPdu]/ComTransmissionDeadlineMonitoring",
        "",
        "MeterStatus の COM_TX_TIMEOUT_METERSTATUS_MS と同じ流儀（First/Timeout",
        "共通で使う）。WarningStatus は DIRECT モード（TMS=false）中は周期送信を",
        "持たないが、TMS=true 中の MIXED 周期フロア",
        "（COM_TX_PERIOD_WARNINGSTATUS_TRUE_FLOOR_MS=2000ms）と同じ桁に揃える。",
        "背景・実機での発動可否は docs/modules/Com_Notes.md「TX 送信デッドライン",
        "監視」参照。"
      ]
    },
    {
      "macro": "COM_TX_REPETITION_PERIOD_IMMOBILIZERSTATUS_MS",
      "value": 100,
      "doc": [
        "ImmobilizerStatus (0x230) の ComTxModeNumberOfRepetitions 再送間隔",
        "（ComTxModeRepetitionPeriod）[ms]",
        "DaVinci: /ActiveEcuC/Com/ComConfig/[ComIPdu]/ComTxModeRepetitionPeriod",
        "",
        "DIRECT モードの変化時送信をトリガーした後、Com_TxConfirmation() による",
        "確認が N+1 回（ComTxModeNumberOfRepetitions+1）届くまでこの間隔で再送する",
        "（[SWS_Com_00305]）。イモビライザー状態のような安全上重要な通知を、",
        "単発の CAN フレーム紛失（バス過渡輻輳等）で見逃さないための冗長送信。",
        "NumberOfRepetitions 自体（回数）は Com_PBCfg.c にインラインリテラルで書く",
        "（DLC 等と同じ「単純な回数は名前を付けない」慣習）。"
      ]
    }
  ],
  "rxIpdus": [
    {
      "name": "EngineInfo_Rx",
      "frame": "EngineInfo",
      "title": "EngineInfo フレーム (エンジン ECU 送信、E2E P05 保護)",
      "note": [
        "IpduGroupId=COM_IPDU_GROUP_SENSOR_RX（2026-08、COM_IPDU_GROUP_NONE",
        "から変更。Bus-Sleep 中の誤ったRXタイムアウト検知を防ぐため）。",
        "詳細は Com_Cfg.h の COM_IPDU_GROUP_SENSOR_RX コメント参照。"
      ],
      "firstTimeoutMs": "COM_TIMEOUT_ENGINE_INFO_MS",
      "timeoutMs": "COM_TIMEOUT_ENGINE_INFO_MS",
      "updateBitPosition": 255,
      "ipduGroupId": "COM_IPDU_GROUP_SENSOR_RX",
      "rxIndicationCbk": "Rte_COMRxInd_EngineInfo",
      "comments": {
        "ipduId": [
          "DaVinci: ComIPduHandleId  - I-PDU 識別番号"
        ],
        "dlc": [
          "DaVinci: ComIPduLength    - I-PDU バイト長",
          "byte[0-1]=E2E CRC16(LE), byte[2]=E2E Counter, byte[3-6]=シグナル"
        ],
        "pduRId": [
          "DaVinci: ComIPduPduRef    - PduR が Com_RxIndication へ渡す DestPduId",
          "(PduR_PBCfg.c PduR_RxDests_Path0[0].DestPduId と一致させること)"
        ],
        "firstTimeoutMs": [
          "DaVinci: ComFirstTimeout",
          "Com_Init 直後・初回受信までの猶予（現状は定常値と同じにして",
          "既存挙動を変えない。将来的に個別調整可能）"
        ],
        "timeoutMs": [
          "DaVinci: ComRxDeadlineMonitoringPeriod（ComTimeout 相当）",
          "初回受信後、以降のエンジン ECU からの受信が途絶えたと",
          "判断するまでの時間"
        ],
        "updateBitPosition": [
          "update-bit なし（Signal Group 専用機能のため未使用）"
        ],
        "ipduGroupId": [
          "BswM が FULL_COM 到達で Start・NO_COMMUNICATION で Stop を呼ぶ"
        ],
        "rxIndicationCbk": [
          "DaVinci: /ActiveEcuC/E2EXf/EngineInfo_Rx_E2EXf",
          "（E2E Transformer 呼び出しは Rte 層が担う）"
        ]
      }
    },
    {
      "name": "AbsInfo_Rx",
      "frame": "AbsInfo",
      "title": "AbsInfo フレーム (ABS ECU 送信、E2E P05 保護)",
      "note": [
        "IsSignalGroup=1（RX Signal Group）: VehicleSpeed/BrakeActive/AbsActive",